"Email","First Name","Last Name","Company Name","Phone Number","Address","Custom 1","Custom 2","Custom 3"
"greg@ellisblb.com","","","","(720) 494-2552","729 Main St","http://www.ellisblb.com/","Income TaxDo you have a looming tax problem or are you just looking to get your taxes filed on time for the current year? We can help. Understanding the tax law can be complicated. We have the resources to navigate the laws and file your returns to ensure you stay compliant.About Income Tax ServicesPayrollWhy mess with the complications and hassle of making sure you’re paying your payroll taxes on time? Let us help! We can work with you to make sure your employees and your taxes are paid when they need to be.More About Payroll ServicesBookkeepingUnhappy with your current bookkeeping situation? You're not alone! Whether you're looking to have someone take on all aspects of your bookkeeping or just need a second eye to make sure things are running smoothly, we can help. We understand each business is unique and cater a specific program for each of our clients.More About Bookkeeping","Income TaxDo you have a looming tax problem or are you just looking to get your taxes filed on time for the current year? We can help. Understanding the tax law can be complicated. We have the resources to navigate the laws and file your returns to ensure you stay compliant.About Income Tax Services"
"sales@pivotalits.com","","","","919.325.4478","1017 Main Campus Dr Suite 2300","https://www.pivotalits.com/","We deliver forward-thinking solutions and critical safeguards that are pivotal to your long-term success.","Innovation expand child menu Solutions Insights & News"
"support@logisuite.com","","","","305-675-8067","7950 NW 53rd St","https://www.logisuite.com/","Logisuite , a leading provider of software solutions for the logistics and transportation industry. We offer a single-platform logistics software solution","Logisuite , a leading provider of software solutions for the logistics and transportation industry. We offer a single-platform logistics software solution"
"support@thedigitalmerchant.com","","","","","3109 Poplarwood Ct #101","https://thedigitalmerchant.com/","TOOLS AND STRATEGIES TO GROW YOUR BUSINESS. From real, experienced owners who use these tools and services to grow their businesses. With 1000+ reviews, comparisons, and guides – all tested by us. Learn More Popular","TOOLS AND STRATEGIES TO GROW YOUR BUSINESS. From real, experienced owners who use these tools and services to grow their businesses. With 1000+ reviews, comparisons, and guides – all tested by us. Learn More Popular"
"info@automatescale.com","","","","1(786) 384-5700","1680 Michigan Ave","http://automatescale.com/","Welcome to Automate Scale! We provide top level expert services to help your business automate and scale using complex sales funnels and other marketing strategies.","Welcome to Automate Scale! We provide top level expert services to help your business automate and scale using complex sales funnels and other marketing strategies."
"info@prudenceb2b.com","","","","","800 Park Offices Dr Suite 3317","https://www.prudenceb2b.com/","Prudence B2B Business Transformation Solutions and Salesforce Services that drive growth with expert strategic management, and Salesforce solutions.","BUILT-IN FEATURESFeature-richProductsand SolutionsData AnalyticsOur products offers comprehensive data analytics, reports, and dashboards right from the start, for every persona.Mobile FriendlyMaximize the functionality of our products on your mobile device, utilizing its full range of features with ease, anywhere.Integration ReadyEnhance collaboration and facilitate seamless data synchronization between systems by integrating our products with any platform."
"info@fulldatasolutions.com","","","","224-288-3329","2706 N Southport Ave","https://fulldatasolutions.com/contact-us/","Solutions Data Management / Analytics NetSuite Alternative Solutions Custom Development / Integrations Inventory Management Fulfillment / 3PL Data Migration Ecommerce Experts ERP Specialist","Solutions Data Management / Analytics NetSuite Alternative Solutions Custom Development / Integrations Inventory Management Fulfillment / 3PL Data Migration Ecommerce Experts ERP Specialist"
"info@alexacpagroup.com","","","","+1 224-323-6214","550 W Washington St #201","http://www.alexacpagroup.com/","Alexa CPA Group in Buffalo Grove: We do the math. Offering expert tax, accounting, and financial services for businesses and individuals. Simplify your finances with us.","Alexa CPA Group in Buffalo Grove: We do the math. Offering expert tax, accounting, and financial services for businesses and individuals. Simplify your finances with us."
"sales@oogatechnologies.com","","","","+1 919.589.7039","4804 Page Creek Ln","https://www.oogatechnologies.com/contact","Platform NDT Expert and AI Tools Marketplace Remote Digital Inspection System Project Management & Training Solution","Book a Free Demo +1 919.589.7039 sales@oogatechnologies.com Mailing Address Ooga Technologies, Inc. 4804 Page Creek Lane Suite 223 Durham, NC 27703 USA Fill out the information below so we can tailor our free demo to your needs We would like … Read More"
"info@corpaccountinginc.com","","","","(773) 866-2272","3017 W Roscoe St # 1","https://www.corpaccountinginc.com/","Services Business Services Small Business Accounting Payroll Part-Time CFO Services Forensic Accounting Cash Flow Management Bank Financing Business Valuation Strategic Business Planning Succession Planning New Business Formation Non-Profit Organizations Internal Controls Litigation Support Tax Services Tax Preparation Tax Planning Tax Problems IRS Audit Representation Non-Filed Tax Returns Back Taxes Owed Payroll Tax Problems IRS Liens IRS Levies IRS Wage Garnishment IRS Seizures IRS Payment Plan Offer In Compromise Bankruptcy Innocent Spouse Relief Get Your IRS File QuickBooks Services Why QuickBooks QuickBooks Setup QuickBooks Training QuickTune-up QuickBooks Tips Buy QuickBooks and Save","Take a look at our Home page. Corporate Accounting Inc. is a full service tax, accounting and business consulting firm located in Chicago, IL."
"info@valenta.io","","","","","6303 Blue Lagoon Drive Waterford, #400","https://us.valenta.io/","Services Services Services Services Consulting Consulting CRM Consulting Cybersecurity Consulting Digital Transformation Consulting ERP Consulting Financial Crime Consulting Franchise Consulting Marketing Consulting Process Optimization Salesforce Consulting Spend Management Sustainability and Climate Change Third Party Vendor Management Zoho Consulting Acumatica Consulting Digital Transformation Digital Transformation Analytics Conversational AI Hyperautomation Intelligent Document Processing Process and Task Mining Robotic Process Automation Test Automation Staff Augmentation Staff Augmentation Accounting & Bookkeeping Accounting & Bookkeeping Accounting & Bookkeeping Specialists Financial Controller Automation & AI Automation & AI AI & Machine Learning Specialists Conversational AI Developers Digital Transformation Specialists Process Automation Specialists RPA Developers Customer Support / Help Desk Customer Support / Help Desk Help Desk Support Analyst Help Desk Technician Data & BI Data & BI Big Data Specialists Business Intelligence Analysts Data Analysts & Data Engineers Data Security Analyts Database Administrator Financial Planning Financial Planning Paraplanner & Financial Planning Admin Fractional C-Level Executives Fractional C-Level Executives Fractional CRO Services Fractional CFO Services Fractional CIO Services Fractional CTO Services Fractional COO Services Fractional CMO Services Healthcare Healthcare AI powered medical billing Medical Scribe Virtual Medical Assistants & Medical Scribes IT & Engineering IT & Engineering Applications Architects Cloud Engineer Cybersecurity Engineer DevOps Engineer Front End Developer Full Stack Developers Java Developers Javascript Developers Mobile Application Developers Network Architect Program Analyst Project Managers Python Developers Salesforce Administrator Salesforce Developer Scrum Master Software and Applications Developers Systems Analyst Systems Engineer Web Developer Zoho Developers Legal Legal Paralegals Virtual Assistants & Admins Virtual Assistants & Admins Onshore Hiring Onshore Hiring","Work Smarter, Faster, & Cut Costs Error-Free with AI-Powered Intelligent Automation We automate your manual & error-prone processes, to address inefficiencies, eliminate errors, cut costs, & future-proof your business Schedule a Free Consult https://valenta.io/wp-content/uploads/2025/05/Valenta-Overview.mp4 Work Smarter, Faster, & Cut Costs Error-Free with AI-Powered Intelligent Automation We automate your manual & error-prone processes, to address inefficiencies, […]"
"info@lorvish.com","","","","(312) 285-1044","4819 Emperor Blvd suit 400","http://www.lorvish.com/","Lorvish Technologies DifferencePioneered a 24 x 7 ASSEMBLY LINE GLOBAL RECRUITING MODEL that can be quickly adopted to individual client needsFocus on """"PROACTIVE"""" project staffing/consulting model and POOLING STRATEGIES to better serve customers and create a competitive edgeAdopt a seamless onsite-offshore model for improved """"EFFICIENCY"""", quicker """"SCALABILITY"""" and better """"CUSTOMER EXPERIENCE""""Align across VERTICALS through a CLUSTER MODEL as opposed to skills, technologies and geographiesCreate an entrepreneurial and passionate work environment that helps in high """"CUSTOMER SATISFACTION"""" and """"RETENTION""""Implement METRIC-DRIVEN tools, FRAMEWORKS and PROCESS to maintain the highest quality of work and accountability.Committed to a passion of EXCELLENCE and exceeding CUSTOMER EXPECTATION.","Lorvish Technologies DifferencePioneered a 24 x 7 ASSEMBLY LINE GLOBAL RECRUITING MODEL that can be quickly adopted to individual client needsFocus on """"PROACTIVE"""" project staffing/consulting model and POOLING STRATEGIES to better serve customers and create a competitive edgeAdopt a seamless onsite-offshore model for improved """"EFFICIENCY"""", quicker """"SCALABILITY"""" and better """"CUSTOMER EXPERIENCE""""Align across VERTICALS through a CLUSTER MODEL as opposed to skills, technologies and geographiesCreate an entrepreneurial and passionate work environment that helps in high """"CUSTOMER SATISFACTION"""" and """"RETENTION""""Implement METRIC-DRIVEN tools, FRAMEWORKS and PROCESS to maintain the highest quality of work and accountability.Committed to a passion of EXCELLENCE and exceeding CUSTOMER EXPECTATION."
"info@prospectrs.com","","","","(612) 293-0179","3508 W 22nd St","http://www.b2bprospectrleads.com/","Prospectr offers B2b lead generation services Assists in generating demand, acquiring leads, and engaging them with tailored B2B marketing strategies for consistent business growth.","Prospectr offers B2b lead generation services Assists in generating demand, acquiring leads, and engaging them with tailored B2B marketing strategies for consistent business growth."
"sales@cloud2talk.com","","","","(786)-688-6808","3001 W Hallandale Beach Blvd Suite 310","http://cloud2talk.com/","With Cloud2Talk, you get all-in-one VoIP service. Our Phone services start as low as $24.95 per line with unlimited calling. We specialize in Technology innovations, all of our customers get unlimited calling, detailed reporting, advanced features such as find me and follow me, call waiting, caller ID, music on hold, and many more features your business can benefit from. VoIP telephony solutions.","With Cloud2Talk, you get all-in-one VoIP service. Our Phone services start as low as $24.95 per line with unlimited calling. We specialize in Technology innovations, all of our customers get unlimited calling, detailed reporting, advanced features such as find me and follow me, call waiting, caller ID, music on hold, and many more features your business can benefit from. VoIP telephony solutions."
"info@corinteractive.com","","","","612-987-4568","200 South 6th St","http://www.corinteractive.com/","“A well designed marketing campaign tells a story about your organization, guides your users to an action and has personality to engage your visitors.”","Performance based digital marketing agency with offices in Duluth & Minneapolis lead by digital marketing expert Cory Fechner. We specialize in data insight & analytics, paid search marketing, social media marketing and SEO."
"mail@mackltd.com","","","","312-368-0677","100 N LaSalle St #2110","http://www.mackltd.com/","A WBE-certified staffing agency that connects employers and best in class administrative support professionals. Hire top talent or find your next job today.","A WBE-certified staffing agency that connects employers and best in class administrative support professionals. Hire top talent or find your next job today."
"sales@dynafile.com","","","","(888) 510-3453","6030 Greenwood Plaza Blvd STE 110","https://www.dynafile.com/","Scan to Cloud HR Document Management Solutions. Unlock the power of digital HR document management with DynaFile. Put your admin tasks on autopilot and boost productivity with document management automation. Get your paperless HR department up and running in 30 days or less! Schedule a tour today!","Scan to Cloud HR Document Management Solutions. Unlock the power of digital HR document management with DynaFile. Put your admin tasks on autopilot and boost productivity with document management automation. Get your paperless HR department up and running in 30 days or less! Schedule a tour today!"
"info@kazmarek.com","","","","(858) 952-5400","5465 Morehouse Dr Suite 150","https://www.kazmarek.com/","Leading managed IT service provider in San Diego for small to medium businesses. We offer proactive monitoring, network security, and expert tech support to boost your business.","Our ServicesDelegate all of your IT support to a collaborative andexperienced partnerMaximize your efficiencies with a customized solution that meets the specific needs of your business. From Managed IT Services to endpoint detection and response, private and public cloud implementation, vCIO, and co-managed IT services, KTS is your one-stop shop for IT support.Explore Our IT Services"
"engitech@oceanthemes.net","","","","614.423.6400","4742 N 24th St #300a","https://skynetmts.com/?","SkyNet MTS provides expert-managed IT services and solutions, including cybersecurity, cloud solutions and data backups. Get started today with us.","SkyNet MTS provides expert-managed IT services and solutions, including cybersecurity, cloud solutions and data backups. Get started today with us."
"inquiry@leanmethods.com","","","","+1 (303) 827-0010","555 17th St #400","http://www.leanmethods.com/","Discover top-tier Operational Excellence and Strategy Consulting. Formerly BMGI, Lean Methods drives Business Transformation with Lean Six Sigma, Hoshin, and Lean solutions—start today!","Discover top-tier Operational Excellence and Strategy Consulting. Formerly BMGI, Lean Methods drives Business Transformation with Lean Six Sigma, Hoshin, and Lean solutions—start today!"
"privacy@ergos.com","","","","713-621-9220","1133 E Missouri Ave Suite J","https://ergos.com/","Expert outsourced IT services including support, consulting, and security to safeguard and optimize your business operations.","Expert outsourced IT services including support, consulting, and security to safeguard and optimize your business operations."
"Luther@snyderinteractive.com","","","","+1 202-656-5384","620 Mendelssohn Ave N #186","https://www.trailblz.com/","Software for Political Campaigns, PACs and Nonprofit Donor Management","Support Contact Support Knowledge Base Experts Center Political Assessing Election Chances Handling Negative Campaign Issues How to Challenge and Beat an Incumbent How to Handle a Tough Audience Lessons from Recent Elections Make Your Database Work as Hard as You Do Strategies to Win an Election as Challenger Targeting and Voter Identification 10 Questions to Ask Before You Run for Office The Ten Percent Difference The Theory of Winning An Election Two Campaign Activities Most Candidates Hate Use a Campaign Issue Box What Can We Learn from the 2014 Election? Non-Profit Four Ways to Ask For Contributions Eleven Questions To Ask Before You Buy Donor Management Software Spreadsheet versus Database Tips for Everyone It’s Back to School Don't Fall Behind Learning Academy Classes & Events Personal Training Video Tutorials Video Tutorials Make a Payment Additional Services YouTube Channel"
"info@myservion.com","","","","(651) 631-3111","500 Main St Ste 210","https://www.myservion.com/","The Servion Group provides credit unions and community banks with the tools to succeed in mortgage lending, commercial lending, real estate, title, and…","Servion Mortgage is equipped to support FIs of virtually any asset size. You can use our services to start a brand new mortgage program or to grow your current one.Learn More"
"support@metapcs.com","","","","833-638-2727","3259 E Harbour Dr Suite 101","https://metapcs.com/","High-performance gaming PCs and custom builds. Computers backed by expert PC builders. Flexible financing options for your dream gaming rig!","OperatorDrewski is a content creator and military simulation enthusiast best known for his immersive gameplay videos and tactical commentary. With a deep passion for realism and authenticity, he’s built a loyal following on YouTube by showcasing mil-sim experiences across games like Squad, Arma, and Escape from Tarkov."
"info@freedomtech.us","","","","910-920-0999","555 Fayetteville St Suite 201","http://www.freedomtech.us/","Is Your Current IT Services Company Cutting Corners, Overcharging You, And NOT Protecting And Securing Your Computer Network As Well As They Should? Give us a call and let us show you what fast, friendly and highly-responsive outsourced managed IT services should be for your small to medium business: 866-795-4335","IT Services Fayetteville, IT Services Southern Pines, IT Services Lillington, IT Services Raleigh, IT Services Sanford, VoiP Fayetteville, VoiP Services Southern Pines, VoiP Services Lillington, VoiP Services Raleigh, VoiP Services Sanford"
"sales@divergeit.com","","","","310-627-2651","1395 Brickell Ave Suite #800","https://www.divergeit.com/","Experience outsourced IT support in California through DivergeIT. Reach out to us today for IT support services for your business in Torrance and nearby areas.","Experience outsourced IT support in California through DivergeIT. Reach out to us today for IT support services for your business in Torrance and nearby areas."
"info@techietalent.net","","","","1 (773) 948-0618","200 E Randolph St","http://techietalent.net/","Custom Software DevelopmentLeverage our agile software development service for accurate and efficient project execution. We use strategies to forecast project outcomes, mitigate risks, and ensure on-time, on-budget delivery.Know More","Nearshore Staff AugmentationEnhance your existing workforce with our skilled Techies. We seamlessly integrate into your operations, complementing your team's capabilities and helping you meet your project goals.Know More"
"info@breakawayadvising.com","","","","(503) 941-0888","1183 Saratoga St","http://www.breakawayba.com/victoria-rozzi","0 Skip to Content Breakaway Advisors Meet Our Advisors Become an Advisor Services Fractional CFO Bookkeeping Family Office News Blog Press Login Contact → Open Menu Close Menu Breakaway Advisors Meet Our Advisors Become an Advisor Services Fractional CFO Bookkeeping Family Office News Blog Press Log","Skip to Content Breakaway Advisors Meet Our Advisors Become an Advisor Services Fractional CFO Bookkeeping Family Office News Blog Press Login Contact → Open Menu Close Menu Breakaway Advisors Meet Our Advisors Become an Advisor Services Fractional CFO Bookkeeping Family Office News Blog Press Login"
"info@citystaffing.com","","","","312-346-3400","211 W Wacker Dr STE 700","http://www.citystaffing.com/","chicago staffing agency, temp agency, professional staffing services, temporary employment, temp to permanent employment, staffing solutions, employment","City Staffing, an award-winning Chicago based agency, extends its excellence nationally. As a woman-owned, WBE-certified entity, we boast a stellar track record. Renowned for connecting companies with skilled professionals, we specialize in contract, temporary, temp-to-hire, and direct hire roles across various fields, including administrative, customer service, accounting, marketing, remote positions, and more. With a focus on cultivating relationships and delivering results, we stand as a premier staffing agency offering services with a commitment to excellence. City Staffing has earned a recurring spot on Forbes America’s Best Professional Staffing Firms, Inc. Magazine’s National Best Workplaces, Chicago Tribune’s Top Workplaces, Crain’s Chicago Top Places to Work, and Inavero’s Best of Staffing™ Client and Talent Lists."
"Info@cardinalgroupmarketing.com","","","","919-621-3409","8801 Fast Park Dr #313","http://www.cardinalgroupmarketing.com/","Cardinal Group Marketing is an award-winning web design and SEO agency in Raleigh, North Carolina providing search engine-friendly website development.","Cardinal Group Marketing is an award-winning web design and SEO agency in Raleigh, North Carolina providing search engine-friendly website development."
"abuse@cogentco.com","","","","(877-726-4368","SunTrust International Center, 1 SE 3rd Ave","http://cogentco.com/","Cogent is one of the world's largest Internet Service Providers, delivering high-quality Internet, Ethernet and Colocation services.","Find out what Cogent can do for youSolutions for Small & Medium BusinessSolutions for EnterprisesSolutions for Carriers and Service ProvidersSolutions for Application and Content Providers"
"info@scarlettculture.com","","","","844.727.5388","4208 Six Forks Rd Suite 1000","https://www.scarlettgroup.com/managed-it-services-raleigh-nc?utm_source=GMB-Raleigh&utm_medium=organic","Find comprehensive IT support and services in Raleigh-Durham. Protect your data and ensure business success with our trusted IT Consulting and Solutions. Providing Computer Support Services, Networking, Cyber Security Solutions, and Data Backup & Recovery in Raleigh, Durham, Chapel Hill, Pittsboro, Sanford, Greensboro, Wilmington, Research Triangle Park. Contact us for reliable IT support! Call 919-436-1600","Scarlett Group is an Award Winning managed service provider in Raleigh, NC. Our Managed IT Services, IT Support, and IT Solutions are Better, Faster, & More Affordable!"
"AccuFund@tlchelp.net","","","","303-347-2934","400 Hillside Ave UNIT 8","https://www.accufund.com/","AccuFund Accounting Suite delivers government and nonprofit financial management software for your accounting and fundraising. SaaS, on-premise and cloud nonpro","Government Solutions ERP Utility Billing Human Resources Management System Representative Payee Integrations Who We Serve Municipalities Special Districts Tribal Nations"
"partsorders-ca@dematic.com","","","","+1-616-588-6368","756 W Peachtree St NW","http://www.dematic.com/","Welcome to Dematic North America. Supply Chain Automation, Material Handling, Warehouse Management, Logistics, Software & IT, and Consulting Services.","Welcome to Dematic North America. Supply Chain Automation, Material Handling, Warehouse Management, Logistics, Software & IT, and Consulting Services."
"info@rms-peo.com","","","","303-741-9911","8101 E Prentice Ave #850","https://rms-peo.com/","Comprehensive payroll solutions designed exclusively for you with 24/7 online access to your information.","Development of your custom solution"
"sales@chronostech.com","","","","","7310 Miramar Rd #410","http://www.chronostech.com/","A great example of how you can talk about your services","A great example of how you can talk about your services"
"info@cspinc.com","","","","(919) 420-3231","1310 Nowell Rd","https://www.cspinc.com/","CSP is an IT Support company and IT Services provider across Raleigh/Durham, Chapel Hill, Cary, Wake Forest and surrounding regions for large and small companies for over 23 years.","CSP is an IT Support company and IT Services provider across Raleigh/Durham, Chapel Hill, Cary, Wake Forest and surrounding regions for large and small companies for over 23 years."
"inquiry@marratech.ai","","","","+1-760-478-6770","10531 4S Commons Dr #166-610","http://ohanaone.com/","Transform your business with MarraTech’s Salesforce consulting, implementation, customization, and support. Achieve seamless CRM solutions and enhanced productivity.","Transform your business with MarraTech’s Salesforce consulting, implementation, customization, and support. Achieve seamless CRM solutions and enhanced productivity."
"support@cloudbadging.com","","","","1-800-996-3581","5830 NW 163rd St","http://cloudbadging.com/","Have multiple locations? No problem.Unlike most ID software, which charge thousands of dollars per user, CloudBadging allows you to create as many users as you need at no additional cost.","Our Badge Design wizard can design your ID Badges for you. Simply upload your logo and answer a few simple questions. Of course you can entirely customize your card using our full card design editor as well."
