"Email","First Name","Last Name","Company Name","Phone Number","Address","Custom 1","Custom 2","Custom 3"
"hr@cloudsasconsulting.com","","","","+1 (972) 799-5895","4091 Ellinger Dr","http://cloudsasconsulting.com/","Welcome to CloudSAS Consulting!Cloud SAS Training and Placement Opportunities at CloudSAS Consulting!We pride ourselves on our ability to provide customized solutions that address our client’s specific challenges and goals.At CloudSAS Consulting, we offer more than justsoftware engineering training; we provide a comprehensive approach to guide you toward a successful career path. Our expertise covers a range of technologies, includingGolang, Java, and various Cloud services.","We pride ourselves on our ability to provide customized solutions that address our client’s specific challenges and goals.At CloudSAS Consulting, we offer more than justsoftware engineering training; we provide a comprehensive approach to guide you toward a successful career path. Our expertise covers a range of technologies, includingGolang, Java, and various Cloud services."
"hi@mailcharts.com","","","","","228 Park Ave S PMB 15707","https://www.mailcharts.com/","Plan campaigns, keep track of your competitors and peers, understand trends in your industry and take control in meetings.","Plan campaigns, keep track of your competitors and peers, understand trends in your industry and take control in meetings."
"rvmartinhardware@yahoo.com","","","","(305) 635-1618","2815 NW 17th Ave","http://www.acehardware.com/store-details/08935?utm_source=google&utm_medium=local&utm_campaign=localmaps&utm_content=08935","Shop at R V Martin Hardware at 2815 NW 17th Ave, Miami, FL, 33142 for all your grill, hardware, home improvement, lawn and garden, and tool needs.","Your local Ace Handyman:(Need a different Location?)Contact InfoProject LocationProject InfoScheduleYour contact information:NextWhere will the work be done?StateAlabamaAlaskaArizonaArkansasCaliforniaColoradoConnecticutDelawareDistrict Of ColumbiaFloridaGeorgiaHawaiiIdahoIllinoisIndianaIowaKansasKentuckyLouisianaMaineMarylandMassachusettsMichiganMinnesotaMississippiMissouriMontanaNebraskaNevadaNew HampshireNew JerseyNew MexicoNew YorkNorth CarolinaNorth DakotaOhioOklahomaOregonPennsylvaniaRhode IslandSouth CarolinaSouth DakotaTennesseeTexasUtahVermontVirginiaWashingtonWest VirginiaWisconsinWyomingBackNextTell us about your project:BackNextChoose a few times that work best for you:123Scheduling your project is easy!Simply choose date & time option(s) that fit your schedule. Rest assured, we'll call to confirm.Date PickerPlease select date to proceed.Morning8am-12pmAfternoon12pm-5pmNextContinue without selecting timesBackNextSubmit"
"contact@cloudjourneygroup.com","","","","972-914-7077","2550 Pacific Ave #700","https://www.cloudjourneygroup.com/","Cloud Journey Group is a Salesforce and Certinia Consulting Partner specializing in business process transformation for SMBs. From implementations to managed services, we deliver tailored solutions in the professional services industry. Experience seamless integration with a business-process-first approach designed to enhance efficiency and profitability. Contact us today for a free consultation.","Cloud Journey Group is a Salesforce and Certinia Consulting Partner specializing in business process transformation for SMBs. From implementations to managed services, we deliver tailored solutions in the professional services industry. Experience seamless integration with a business-process-first approach designed to enhance efficiency and profitability. Contact us today for a free consultation."
"hiawatha@reddyrents.com","","","","(612) 722-9516","4411 Hiawatha Ave","https://www.toolrentalsmn.com/?utm_source=google&utm_medium=wix_google_business_profile&utm_campaign=1502938830749435584","ToolRentalsMN is your go-to source in Minneapolis for construction equipment rental, roofing tools, restoration supplies, concrete saws, and demolition gear. From skid steers and lifts to Brokk machines, core drills, mold cleaners, and PPE Daily, weekly, & monthly rates available. Huge selection, competitive pricing. tool rentals Minneapolis, construction equipment rental MN, contractor tool sales, heavy duty tools for rent, roofing and concrete equipment Minneapolis, tool distribution Minnesota","Welcome to ToolRentalsMN.com, an esteemed affiliate of Reddy Rents, which has been cornerstone in the rental equipment industry since its inception in 1963. Established by Fitzgerald and Bill Jasper, Reddy Rents has evolved from a modest rental store into a reputable provider two locations in St. Louis Park and South Minneapolis. As a proud member of both the American Rental Association and the Minnesota Rental Association, we are committed to staying abreast of advancements in equipment and technology, allowing us to better serve our customers and maintain our community relevance. Our dedication to exceptional customer service ensures that we offer a comprehensive selection of well-maintained equipment for construction, landscaping, and building maintenance, empowering our customers with the best tools for their projects. We invite you to join us in upholding the tradition of quality and reliability that Reddy Rents has exemplified for decades."
"hello@dd.nyc","","","","+1 212.380.1761","85 Broad St 17th Floor - Suite, #17.005","https://dd.nyc/?utm_source=gmb&utm_medium=google&utm_campaign=gmb-oo","DD.NYC® (M/WBE) is an award-winning creative digital design agency, specializing in branding, web design, graphic & packaging design, video production shoots.","Web DesignLandingBrochure SiteCorporate WebsiteE-CommerceWeb 3.0UI/UX DesignWe create world-class websites using modern design practices. Mobile-first websites and web experiences are essential to the success of your web project. While maintaining bespoke originality, our team will focus on responsive design and optimize your website for any device and interface. Your new website will attract desirable target audiences, boost engagement, drive sales, and increase the brand value of your business.Learn moreBrandingCorporateBeautyF&BWeb 3.0HospitalityRe-BrandingOur branding team will excel at presenting your business in its best light. Whether you’re looking to attract a new set of eyes, rekindle an old client base, or simply refine your business’s identity - our creatives will formulate the optimal corporate identity, collateral designs, and brand guidelines unique to your company’s needs. Armed with your new bespoke brand - you will now be able to captivate engaged new audiences and capitalize on your company’s full potential.Learn moreGraphic DesignPrint GraphicsConference Event BrandingDeck DesignsDigital Brand CollateralSocial Media DesignsOur innovative graphic design team will create the digital and print designs for your project. Having both startup and enterprise experience, our designers consider differing execution and audience demographics when designing a pixel-perfect graphic for each unique client challenge. Following an existing brand guideline or a specific reference in mind, our team will deliver a sleek, clean design within timeline and budget.Learn morePackaging DesignConsumer Good PackagingMerchandise PackagingBeverage PackagingStartup Product PackagingExperienced with top-grade packaging design for a wide range of products from consumer goods to startup ideas. Your packaging design will exceed all expectations with fresh yet pragmatic design ideas realistic to produce by the creatives at DD.NYC®. Packaging design is what makes us fall in love with some of our favorite products. Make yours a favorite.Learn moreVideo ProductionCorporate Video ProductionEvent Video ProductionPromotional VideosPost-Production & EditingDD.NYC® specializes in video production since 2015 in Manhattan, our talented team leverages over 30 years of combined experience working with advertising agencies and brands to create exceptional visual narratives. We are dedicated to video excellence, crafting impactful content that authentically engages audiences and elevates brands.Learn MoreLandingBrochure SiteCorporate WebsiteE-CommerceWeb 3.0UI/UX DesignWe create world-class websites using modern design practices. Mobile-first websites and web experiences are essential to the success of your web project. While maintaining bespoke originality, our team will focus on responsive design and optimize your website for any device and interface. Your new website will attract desirable target audiences, boost engagement, drive sales, and increase the brand value of your business.Learn more"
"sales@mycloudit.com","","","","+1 877-692-6194","1101 Venture Ct","https://mycloudit.com/","Build and expand your company with our fully white-labeled suite of profitable and scalable cloud services.","MyCloud PBX is a fully featured VoIP solution integrates seamlessly with Microsoft Teams, exactly what thetypical client is looking for. Great features, easy to manage, at great margins."
"ralph@atma-sphere.com","","","","651-690-2246","1742 Selby Ave","http://www.atma-sphere.com/","Balanced tube preamplifiers & OTL valve amplifiers for audiophiles. Hand made in the USA.","An insight into how we build our award-winning OTL amplifier""""Making the Atma-Sphere M-60"""""
"sam.welna@gmail.com","","","","(612) 729-3526","2438 Bloomington Ave","http://www.acehardware.com/mystore/index.jsp?store=07166&cid=localstore07166","Shop at Welna Hardware Inc at 2438 Bloomington Ave, Minneapolis, MN, 55404 for all your grill, hardware, home improvement, lawn and garden, and tool needs.","Your local Ace Handyman:(Need a different Location?)Contact InfoProject LocationProject InfoScheduleYour contact information:NextWhere will the work be done?StateAlabamaAlaskaArizonaArkansasCaliforniaColoradoConnecticutDelawareDistrict Of ColumbiaFloridaGeorgiaHawaiiIdahoIllinoisIndianaIowaKansasKentuckyLouisianaMaineMarylandMassachusettsMichiganMinnesotaMississippiMissouriMontanaNebraskaNevadaNew HampshireNew JerseyNew MexicoNew YorkNorth CarolinaNorth DakotaOhioOklahomaOregonPennsylvaniaRhode IslandSouth CarolinaSouth DakotaTennesseeTexasUtahVermontVirginiaWashingtonWest VirginiaWisconsinWyomingBackNextTell us about your project:BackNextChoose a few times that work best for you:123Scheduling your project is easy!Simply choose date & time option(s) that fit your schedule. Rest assured, we'll call to confirm.Date PickerPlease select date to proceed.Morning8am-12pmAfternoon12pm-5pmNextContinue without selecting timesBackNextSubmit"
"Ed@pomeroytool.com","","","","+1 (952) 935 1951","2238 Florida Ave S","https://www.pomeroytool.com/","Pomeroy Tool, Inc. is located in St. Louis Park, MN, United States and is a machine shop that offers high quality, and precise metalworking with CNC machines.","Our mission is to provide exceptional customer service and quality to our customers, while staying up to date with the latest technology in the ever-changing manufacturing industry. Quality parts on time every time."
"adrienne.bryant@bcreaz.com","","","","(480) 802-8100","2233 N 7th St","https://bcreaz.com/","With a talented team of strategists and brokers, we provide professional, commercial real estate services you can rely on at Bryant Commercial Real Estate in Phoenix, AZ and Nationally with our CRE Broker Network","Commercial Real Estate Services, Properties, Brokers, Bryant Commercial Real Estate, Phoenix, AZ, Tenant Representation, Landlord, Business Owners, Small Business, Franchise, Retail, Tenant Rep, CRE,"
"hello@weldhouse.com","","","","602.805.5000","2215 E University Dr","http://weldhouse.com/","Home About Product Design Contact Home About Product Design Contact Home About Product Design Contact Home About Product Design Contact","If you are looking for the Commercial Custom Welding pieces that are one of a kind and a true form of art, then check out Weld House today!"
"info@ecommercenext.org","","","","","115 Genevieve Ct","https://www.ecommercenext.org/","At eCommerce Next, we stand true to our name – informing you what’s next in the game. As the e-commerce domain continues to expand, this dynamic industry moves leaps-and-bounds in all directions. It can get disorienting to keep a track of the gazillion things that happen in the online market every day. This is where we step in. From the latest happenings to the upcoming trends, our eyes and ears stay fixated on the global e-commerce market. Our goal is not just limited to reporting the news, but also informing and educating our audience.","eCommerce News Amazon News ecommerce marketplace Shopify ecommerce trends B2B eCommerce PR Delivery, Logistics & Fulfillment B2C ecommerce Artificial Intelligence (AI) Customer Data Platform (CDP) Product News Customer Experience Payments Funding M&A VC"
"info@valant.com","","","","888-282-8085","1700 7th Ave #2100","http://www.valant.io/","Product Clinical Care Clinical Documentation AI Notes Assist Coming Soon Intake & Assessment Automation ePrescribing Group Therapy Software PDMP Treatment Planning eLabs Clinical Reporting Telehealth Practice Management Billing Scheduling Prospective Patient Management Integrated Credit Card Processing Consent and Intake Forms Performance Reporting Integrated Clearinghouse Solution Eligibility Checking EHR API Management Claim Assist Patient Experience Patient Portal Telehealth Online Bill Pay Integrated Patient Communications","Behavioral Health EHR - See Why Behavioral Health Professionals Prefer Valant, the Market Leader for EHR."
"sales@commercepundit.com","","","","+1 770-285-8191","2675 Breckinridge Blvd Suite 250","https://www.commercepundit.com/?utm_source=gmb&utm_medium=organic&utm_campaign=gmbwebsitelink","We are a Full-Service Digital eCommerce Agency & eCommerce Solutions provider company in Atlanta helping B2C & B2B businesses grow since 2009.","We are a Full-Service Digital eCommerce Agency & eCommerce Solutions provider company in Atlanta helping B2C & B2B businesses grow since 2009."
"info@eastmontdigital.com","","","","","3423 Piedmont Rd NE","https://eastmontdigital.com/","We work with brands to grow direct-to-consumer (DTC) eCommerce businesses with a focus on Shopify Plus & BigCommerce websites.","We work with brands to grow direct-to-consumer (DTC) eCommerce businesses with a focus on Shopify Plus & BigCommerce websites."
"Sales@stratnet.com","","","","877-599-3999","71 Stevenson St # 400","http://www.stratospherenetworks.com/","We help businesses quickly identify leading UCaaS, CCaaS, CX, digital transformation, business process outsourcing, managed IT and cybersecurity solutions.","Stratosphere Networks provides Chicago-based IT support and managed IT services to businesses. Contact us @ 877-599-3999 or sales@stratospherenetworks.com to learn more."
"hr@mobcoder.com","","","","","11245 35th Ave S SW","https://mobcoder.com/","Mobcoder is a leading mobile and web app development company offering innovative, scalable, and tailored solutions. Partner with us for cutting-edge technology and exceptional results.","Mobile app development, web app development, top app development company, Mobcoder, innovative app solutions, scalable app development, custom app development, app development services, cutting-edge technology, mobile and web development."
"hey@uncap.com","","","","(312) 469-0944","8770 W Bryn Mawr Ave #1300","https://www.uncap.com/","Uncap, a Chicago-based Shopify Premier Partner, delivers Shopify Plus B2B solutions for manufacturers and distributors. We boost KPIs, lower TCO, and build private portals and hybrid storefronts.","Uncap, a Chicago-based Shopify Premier Partner, delivers Shopify Plus B2B solutions for manufacturers and distributors. We boost KPIs, lower TCO, and build private portals and hybrid storefronts."
"hello@appiolabs.com","","","","+1(415) 582 1475","2261 Market St STE 10229","https://www.appiolabs.com/","We bridge the gap between your business and cutting-edge cloud solutions, powering your digital transformation.","Improve your business operations with tailored software that fits your unique needs. Streamline processes, boost efficiency, and gain a competitive edge with powerful cloud collaboration tools. Ready to revolutionize your workflows? Let's create your perfect solution today!"
"info@bbincubator.com","","","","+1 773 539 9328","346 N Justine St Ste 302","http://www.bbincubator.com/","BBI is the one-stop-shop omnichannel logistics provider to grow your business with a full, scalable and turnkey Business Solution","BBI is the one-stop-shop omnichannel logistics provider to grow your business with a full, scalable and turnkey Business Solution"
"support@reportartists.com","","","","(559)836-4919","8480 Honeycutt Rd Ste. 200","http://www.reportartists.com/","We provide enterprise-scale Power BI Reporting Services.","We help organizations define KPIs that can be calculated from the information in their existing systems. Then we help define “who needs to see what” and put those KPIs at their fingertips. We strive to maximize integrations with the rest of the Microsoft Suite of products, most notably, Microsoft Teams."
"rruggiero@teamlogicit.com","","","","310-385-8548","751 N Formosa Ave","https://www.teamlogicit.com/LosAngelesCA512","TeamLogic IT in Los Angeles, CA provides managed IT services, support and technology consulting for businesses of all sizes. We are local with a national presence. Contact us today to learn more.","IT Consulting, IT Support, IT Companies, IT Service, IT Company, IT Services, Computer Network, Managed IT Services, IT Solutions"
"info@americaneagle.com","","","","(312) 291-5970","20 N Wacker Dr #970","https://www.americaneagle.com/locations/chicago","Americaneagle.com, a Chicago web agency, provides superior web design, development, hosting and security, digital marketing, and post-launch services across the Chicagoland area and the globe.","Americaneagle.com, a Chicago web agency, provides superior web design, development, hosting and security, digital marketing, and post-launch services across the Chicagoland area and the globe."
"brian@scottsdaleace.com","","","","(480) 496-0058","4825 E Warner Rd #16","http://www.acehardware.com/mystore/index.jsp?store=06677&cid=localstore06677","Shop at Ace Hardware & Rental at 4825 E Warner Rd #16, Phoenix, AZ, 85044 for all your grill, hardware, home improvement, lawn and garden, and tool needs.","Your local Ace Handyman:(Need a different Location?)Contact InfoProject LocationProject InfoScheduleYour contact information:NextWhere will the work be done?StateAlabamaAlaskaArizonaArkansasCaliforniaColoradoConnecticutDelawareDistrict Of ColumbiaFloridaGeorgiaHawaiiIdahoIllinoisIndianaIowaKansasKentuckyLouisianaMaineMarylandMassachusettsMichiganMinnesotaMississippiMissouriMontanaNebraskaNevadaNew HampshireNew JerseyNew MexicoNew YorkNorth CarolinaNorth DakotaOhioOklahomaOregonPennsylvaniaRhode IslandSouth CarolinaSouth DakotaTennesseeTexasUtahVermontVirginiaWashingtonWest VirginiaWisconsinWyomingBackNextTell us about your project:BackNextChoose a few times that work best for you:123Scheduling your project is easy!Simply choose date & time option(s) that fit your schedule. Rest assured, we'll call to confirm.Date PickerPlease select date to proceed.Morning8am-12pmAfternoon12pm-5pmNextContinue without selecting timesBackNextSubmit"
"Feedback@MulliganFunding.com","","","","844-437-3863","4715 Viewridge Ave Suite 100","https://www.mulliganfunding.com/","Highly rated lending partner providing businesses like yours with access to the funding you need, when you need it. Rated 4.9/5 on Trustpilot!","Functional cookies help to perform certain functionalities like sharing the content of the website on social media platforms, collect feedbacks, and other third-party features."
"info@regencycenters.com","","","","1 303 300 5300","3004-3100 Wake Forest Rd","https://www.regencycenters.com/property/detail/60673/Holly-Park","Retail space for lease in Raleigh, NC. Restaurant space for lease in Raleigh, NC. Commercial space in North Carolina.","Prime location inside Raleigh’s Inner Beltline, with a strong daytime population and best-in-class retailers."
"Tylisa.Finley@doa.nc.gov","","","","984-236-0040","301 N Wilmington St # 450","https://www.doa.nc.gov/divisions/state-construction-office","North Carolina Department of AdministrationMailing Address1301 Mail Service CenterRaleigh,NC27699-1301Physical Address325 N. Salisbury StreetRaleigh, NC 27603Contact UsDivisionsBoards & CommissionsNewsAbout DOACareers","The State Construction Office oversees the planning, design and construction of state facilities across North Carolina."
"info@globalit.com","","","","(213) 403-0111","600 W 7th St","https://globalit.com/","Get secure, scalable IT services from Global IT. Managed support, cybersecurity, and cloud—customized for your business.","Get secure, scalable IT services from Global IT. Managed support, cybersecurity, and cloud—customized for your business."
"sandiego@ultimatestaffing.com","","","","(858) 513-7077","9655 Granite Ridge Dr #200","https://www.ultimatestaffing.com/locations/view/san-diego/","Ledgent Finance & Accounting inLa Jolla »Ledgent specializes in the placement of finance and accounting professionals, including accountants, bookkeepers, controllers, payroll specialists, CFOs and more.More details »Ledgent Technology inSan Diego »Ledgent Technology specializes in the placement of IT and technology professionals, including software developers, IT Help Desk support, network engineers, business analysts, web designers, CIOs and more.More details »Adams & Martin Group inSan Diego »Adams & Martin Group specializes in legal staffing, attorney search, and litigation solutions. We place attorneys as well as legal support roles such as paralegals and legal secretaries, as well as document review teams.More details »","Ultimate Staffing San Diego is proud to support the San Diego County area, including: San Diego, CA; Poway, CA; Chula Vista, CA; Santee, CA; El Cajon, CA; National City, CA; La Mesa, CA; Lemon Grove, CA; Lakeside, CA; Imperial Beach, CA and more!"
"info@cloud9.net","","","","(914) 696-4000","222 Bloomingdale Rd Suite 403","http://www.cloud9.net/","Reliable IT support company in Westchester County offering managed IT services, cybersecurity, cloud solutions, and expert tech support for local businesses.","Reliable IT support company in Westchester County offering managed IT services, cybersecurity, cloud solutions, and expert tech support for local businesses."
"contact@adoc-solutions.com","","","","+1 786 642 4478","990 Biscayne Blvd Office 701","http://www.adoc-solutions.com/?utm_source=google&utm_medium=wix_google_business_profile&utm_campaign=17340495567074597968","ADOC Solutions propose des prestations de numérisation et des solutions digitales sur mesure pour optimiser la gestion documentaire et la performance.","ADOC Solutions propose des prestations de numérisation et des solutions digitales sur mesure pour optimiser la gestion documentaire et la performance."
"contact@turncommerce.com","","","","1-303-893-0404","2635 Walnut St","https://www.turncommerce.com/contact/","We are technology solutions professionals with a proven track record for excellence, providing products and services that help people establish their Web presence.","We are technology solutions professionals with a proven track record for excellence, providing products and services that help people establish their Web presence."
"support@homebot.ai","","","","","3513 Brighton Blvd","http://homebot.ai/","Automate homeowner insights and close more loans with Homebot’s homeownership platform. Deliver personalized equity reports that win repeat business.","Automate homeowner insights and close more loans with Homebot’s homeownership platform. Deliver personalized equity reports that win repeat business."
"cs@contractcare.net","","","","(312)-275-3000","135 N Kedzie Ave","https://a4cb.org/","We seek to support small business owners over the long term,from idea to maturity. How can we help your business?CapitalWe provide loans up to $500K and grants as availableCoachingWe provide 1:1 and group coaching opportunities to grow your businessConnectionsWe can provide kitchen space, licensing, procurement services to support your businessOur Services","Schedule a coaching session with an Ally Schedule a Session"
"admin@cloudinstitute.org","","","","(212) 645-9930","307 7th Ave","https://cloudinstitute.org/","We prepare school systems and their communities to educate for a sustainable future through meaningful content and learner-centered instruction. We are committed to the roles that teaching, learning, and thinking play in contributing to the shift toward a sustainable future. Our work with schools resolves around professional learning, curriculum, instruction and assessment.","We prepare school systems and their communities to educate for a sustainable future through meaningful content and learner-centered instruction. We are committed to the roles that teaching, learning, and thinking play in contributing to the shift toward a sustainable future. Our work with schools re"
"luism.florez@eyecatch.mx","","","","(954) 636-5050","7037 NW 5th Ct","https://www.eyecatch.co/","Upgrade your business with dynamic Digital Menu Boards & Signage Solutions. Engage customers and display real-time content with ease.","Services Digital Menu Boards Convenience Digital Signage Digital Signage for Retail Digital Signage for Corporate Communication Supermarket Digital Signage Sales Office Digital Signage Content Creation Services Digital Signage Integration"
