"Email","First Name","Last Name","Company Name","Phone Number","Address","Custom 1","Custom 2","Custom 3"
"vera@wipmdc.com.","","","","202-362-4642","3539 Porter St NW","http://wipmdc.com/","Our property management services maximize owners' income by obtaining the highest rent possible, minimizing vacancies and efficiently managing expenses.","Welcome to Washington Investment Property Management . We are a full-service property management and leasing firm specializing in single and multi-unit residential properties in Washington, DC. We will care for your property as if it were our own."
"bernie@growthwheel.com","","","","+1 646 918 1809","240 Kent Ave floor 2","http://www.growthwheel.com/","GrowthWheel® is a visual toolbox and cloud-based platform used by business advisors to help client companies make decisions and take action with a 360° view on the company.","GrowthWheel® is a visual toolbox and cloud-based platform used by business advisors to help client companies make decisions and take action with a 360° view on the company."
"csvc@wmata.com","","","","202-962-1195","4000 Garden City Dr","https://www.wmata.com/rider-guide/lost-found/","SERVICEDELAYSSERVICEDELAYSXblue Rail LineExpect residual delays to New Carrollton and Downtown Largo following an earlier medical emergency at Capitol South.green Rail Line● Express shuttle bus service is available between Branch Avenue and Southern Avenue through August 31st.● Branch Avenue, Suitland and Naylor Road stations are closed through August 31st due to summer construction. Free shuttle buses are available between Branch Avenue and Southern Avenue. Info:https://www.wmata.com/majorconstructionorange Rail LineExpect residual delays to New Carrollton and Downtown Largo following an earlier medical emergency at Capitol South.silver Rail LineExpect residual delays to New Carrollton and Downtown Largo following an earlier medical emergency at Capitol South.A12A12 Service Alert: Expect delays in both directions on Route A12 because of operator availability. Check your bus location by visitinghttps://metropulse.wmata.com/busA40A40 Service Alert: Expect eastbound delays on Route A40 at Columbia Pike & S Dinwiddie St because of an incident. Check your bus location by visitinghttps://metropulse.wmata.com/busA58A58 Service Alert: Expect delays in both directions on Route A58 because of operator availability. Check your bus location by visitinghttps://metropulse.wmata.com/busC23C23 Service Alert: Expect delays in both directions on Route C23 because of operator availability. Check your bus location by visitinghttps://metropulse.wmata.com/busC27C27 Service Alert: Expect eastbound delays on Route C27 at DC Village because of a vehicle mechanical problem. Check your bus location by visitinghttps://metropulse.wmata.com/busC31C31 Service Alert: Expect eastbound delays on Route C31 at Pennsylvania Ave SE & Minnesota Ave because of an incident. Check your bus location by visitinghttps://metropulse.wmata.com/busC51C51 Service Alert: Expect southbound delays on Route C51 at New Jersey Ave NW & Q St because of an incident. Check your bus location by visitinghttps://metropulse.wmata.com/busC53C53 Service Alert: Expect delays in both directions on Route C53 because of operator availability. Check your bus location by visitinghttps://metropulse.wmata.com/busC75C75 Service Alert: Expect southbound delays on Route C75 at Georgia Av NW & Kansas Ave because of a route blockage. Check your bus location by visitinghttps://metropulse.wmata.com/busD20D20 Service Alert: Expect delays in both directions on Route D20 because of operator availability. Check your bus location by visitinghttps://metropulse.wmata.com/busD4XD4X Service Alert: Expect delays in both directions on Route D4X because of operator availability. Check your bus location by visitinghttps://metropulse.wmata.com/busD50D50 Service Alert: Expect delays in both directions on Route D50 because of operator availability. Check your bus location by visitinghttps://metropulse.wmata.com/busF20F20 Service Alert: Expect delays in both directions on Route F20 because of operator availability. Check your bus location by visitinghttps://metropulse.wmata.com/busM20M20 Service Alert: Expect delays in both directions on Route M20 because of operator availability. Check your bus location by visitinghttps://metropulse.wmata.com/busM42M42 Service Alert: Expect delays in both directions on Route M42 because of operator availability. Check your bus location by visitinghttps://metropulse.wmata.com/busP16P16 Service Alert: Expect northbound delays on Route P16 because of an incident. Check your bus location by visitinghttps://metropulse.wmata.com/bus•••View all Status & AlertsMetroPulseSign up for MetroAlertsLast Updated: 11:42 AMTRIP PLANNERTRIP PLANNERFROM(has autocomplete)TO(has autocomplete)NEXT BUSXNEXT BUSSearch for transportation near youNearby Bus LinesAll Bus LinesNEXT TRAINXNEXT TRAINSearch for transportation near youNearby StationsAll StationsAddison Road-Seat PleasantAnacostiaArchives-Navy Memorial-Penn QuarterArlington CemeteryAshburnBallston-MUBenning RoadBethesdaBraddock RoadBranch AveBrookland-CUACapitol HeightsCapitol SouthCheverlyClarendonCleveland ParkCollege Park-U of MdColumbia HeightsCongress HeightsCourt HouseCrystal CityDeanwoodDowntown LargoDunn Loring-MerrifieldDupont CircleEast Falls ChurchEastern MarketEisenhower AvenueFarragut NorthFarragut WestFederal Center SWFederal TriangleFoggy Bottom-GWUForest GlenFort TottenFranconia-SpringfieldFriendship HeightsGallery Pl-ChinatownGeorgia Ave-PetworthGlenmontGreenbeltGreensboroGrosvenor-StrathmoreHerndonHuntingtonHyattsville CrossingInnovation CenterJudiciary SquareKing St-Old TownL'Enfant PlazaLandoverLoudoun GatewayMcLeanMcPherson SquareMedical CenterMetro CenterMinnesota AveMorgan BoulevardMt Vernon Sq 7th St-Convention CenterNavy Yard-BallparkNaylor RoadNew CarrolltonNoMa-Gallaudet UNorth BethesdaPentagonPentagon CityPotomac AvePotomac YardReston Town CenterRhode Island Ave-BrentwoodRockvilleRonald Reagan Washington National AirportRosslynShady GroveShaw-Howard USilver SpringSilver Spring Transit CenterSmithsonianSouthern AvenueSpring HillStadium-ArmorySuitlandTakomaTenleytown-AUTwinbrookTysonsU Street/African-Amer Civil War Memorial/CardozoUnion StationVan Dorn StreetVan Ness-UDCVienna/Fairfax-GMUVirginia Square-GMUWashington Dulles International AirportWaterfrontWest Falls ChurchWest HyattsvilleWheatonWiehle-Reston EastWoodley Park-Zoo/Adams MorganLineCarsDestinationMinutesLineCarsDestinationMinutesLineCarsDestinationMinutesLineCarsDestinationMinutesLast Data Update:EDT|Data will refresh every 20 seconds.","Metro news and service information for the Washington, DC, Maryland, and Virginia region."
"Sales@itascaSoftware.com","","","","+1 (612) 371-4711","111 3rd Ave S","http://www.itascacg.com/","Welcome to Itasca Consulting Group, your trusted partner in geomechanics, hydrogeology, and engineering solutions. Explore our expertise, innovative…","itasca consulting group, geomechanics solutions, hydrogeology expertise, engineering services, software, engineering software, imat, pfc, flac3d, mining, energy, materials, civil engineering, itasca, employee-owned, contact itasca, industry expertise"
"hellostudent@serveuniversity.org","","","","404-500-8822","585 McWilliams Rd SE","https://www.serveuniversity.org/","For mission-based organizations and entrepreneurs seeking grant funding, SERVE University provides comprehensive grant writing and training services customized for each organization and accomplished with acumen, analysis, and accuracy.","For mission-based organizations and entrepreneurs seeking grant funding, SERVE University provides comprehensive grant writing and training services customized for each organization and accomplished with acumen, analysis, and accuracy."
"info@ulgatl.org","","","","(404) 659-1150","230 Peachtree St #2600","https://ulgatl.org/","Empowering Families, Changing Lives The Urban League of Greater Atlanta is committed to ensuring equal opportunity and economic justice for rural and urban communities throughout the state. We advance through exceptional programs delivered in partnership with community, business, public, and private sector leaders, and individual contributors. Learn how the Urban League helps clients reach their","Empowering Families, Changing Lives The Urban League of Greater Atlanta is committed to ensuring equal opportunity and economic justice for rural and urban communities throughout the state. We advance through exceptional programs delivered in partnership with community, business, public, and private sector leaders, and individual contributors. Learn how the Urban League helps clients reach their"
"scs@seattlecorporatesearch.com","","","","206-814-9939","2101 4th Ave Suite 1975","http://www.seattlecorporatesearch.com/","At SCS (Seattle Corporate Search) we build powerhouse teams for startups and enterprise companies nationwide. Our custom hiring solutions deliver real results.","At SCS (Seattle Corporate Search) we build powerhouse teams for startups and enterprise companies nationwide. Our custom hiring solutions deliver real results."
"info@deyoung-consulting.com","","","","218-215-8065","TriTech Center, 331 2nd Ave S #441","http://www.deyoungconsultingservices.com/","The expert team at DeYoung Consulting works collaboratively with their clients and is dedicated to their strategic needs, building trust and community as a vital part of the process.","The expert team at DeYoung Consulting works collaboratively with their clients and is dedicated to their strategic needs, building trust and community as a vital part of the process."
"hello@h10capital.com","","","","(206) 518-5000","2921 Eastlake Ave E","http://www.h10capital.com/","Our experts ensure compliance, debugging, and data analysis to meet industry standards and exceed quality expectations.","We offer software solutions from device testing, to embedded software development, and even web and mobile applications tailored to your needs."
"info@smxusa.com","","","","(305) 463-7191","1000 Brickell Ave ste 900","http://www.smxusa.com/","When it comes to IT solutions & engineering staffing, we give you the world. Get local expertise and international reach with a staffing partner who breaks down talent barriers to deliver high-caliber resources + highly targeted services. IT Staffing Specialized staff augmentation with a technical focus - SMX Services & Consulting USA","When it comes to IT solutions & engineering staffing, we give you the world. Get local expertise and international reach with a staffing partner who breaks down talent barriers to deliver"
"Atlanta@RubicoTech.com","","","","469-209-9044","701 Brazos St Ste 500","https://rubicotech.com/","Are you ready to finally solve your web and mobile app problems? Outsource your software to a dedicated team. Start your project with Rubico today!","Are you ready to finally solve your web and mobile app problems? Outsource your software to a dedicated team. Start your project with Rubico today!"
"Info@DelaneyBusinessSolutions.com","","","","305-871-9829","1110 Brickell Ave Suite 430","https://www.delaneybusinesssolutions.com/","Info@DelaneyBusinessSolutions.com","Info@DelaneyBusinessSolutions.com"
"info@texaslibertytech.com","","","","(512) 203-7448","4811 Lansing Dr","http://www.texaslibertytech.com/","We can architect and develop custom software solutions to accelerate your business workflow.","Robert is very knowledgeable and resourceful. He is proactive, quick, and eager to assist in all circumstances. He helps us with solutions and is mindful of our budget. I am very pleased with his services and our entire team is thankful for the working relationship we have established."
"info@buildepicconsulting.com","","","","(480) 353-6689","8650 N 9th Ave","https://buildepicconsulting.com/","Build Epic Consulting is a full-service digital marketing company offering website design, Search Engine Optimization, Video Production, and Graphic Design.","Build Epic Consulting is a full-service digital marketing company offering website design, Search Engine Optimization, Video Production, and Graphic Design."
"info@cshiftconsulting.com","","","","(720) 341-1983","4645 Broadway Ste C3","http://www.cshiftconsulting.com/","LearningWe pride ourselves in building learning cultures. A curious workforce that is committed to continuous improvement and constant inquiry will drive the companies of the future.Learn More","We pride ourselves in building learning cultures. A curious workforce that is committed to continuous improvement and constant inquiry will drive the companies of the future.Learn More"
"zan@zandesign.com","","","","720-560-1969","655 Juniper Ave","https://zandesign.com/","Welcome to Zan Design, Inc., your go-to resource for reliable and professional web design services. Our team specializes in WordPress websites created with the Divi Theme Builder by Elegant Themes, making it easy to create a stunning website that reflects your brand and captures the attention of your audience.","Intelligent website design where each site is crafted to ensure a seamless user experience, maintaining high performance and visual appeal across varying screen sizes and resolutions, providing an optimal user experience no matter how your audience accesses your site."
"solutions@hellotonic.com","","","","(720) 726-9865","1444 Wazee St #310","https://hellotonic.com/?utm_source=gmb_traffic&utm_medium=organic","We are an award-winning, 100% US-based, custom digital transformation consulting company in Denver, CO. Specializing in development of web and mobile apps. Learn more.","Services Solutions Technology Consulting Application Development Staffing Expertise Strategy Design Development"
"refresh@vivifypro.com","","","","602-456-2755","221 E Indianola Ave","http://vivifypro.com/","At Vivify I help startups untangle the messes, find clarity, and move forward with strategic steps that feel right. We strip away the ‘shoulds’ and build from the inside out—with strong foundations, smart tools, and a whole lot of of ‘hell yes, I’ve got this’.","top of page Skip to Main Content HOME COACHING ABOUT FAQ's CONTACT EVENTS business coaching for solo-preneurs & micro-small businesses powered by you Guided by me You don't need another course or checklist. You need someone who can help you see the big picture and move smart inside it—someone who ge"
"john@johnruh.com","","","","(773) 775-6636","6967 N Tonty Ave","https://www.johnruh.com/","Ready to Experience The Power of Right Culture? “Culture is the foundation of Life and Business” John M. Ruh Our Promise to You! Partner with you to create a 2025 Unique Empowering Game plan built on your Culture – Read 3 Obvious Signs You Have a Culture Issue Create a context/philosophy where leadership development and","Ready to Experience The Power of Right Culture? “Culture is the foundation of Life and Business” John M. Ruh Our Promise to You! Partner with you to create a 2025 Unique Empowering Game plan built on your Culture – Read 3 Obvious Signs You Have a Culture Issue Create a context/philosophy where leadership development and"
"connect@layer27.com","","","","866-620-2641","406 Blackwell St #220","https://layer27.com/","Frustrated With The Lack Of Responsiveness And Slow Service From Your Current IT Services Company? Give us a call and discover how great local IT services and computer support can be! Business Owners, Call Now For Immediate Support.","IT Managed Services Raleigh, Cybersecurity Solutions Raleigh, Cloud Services Raleigh, Data Backup and Recovery Services Raleigh, IT Consulting Raleigh, IT Managed Services Durham, Cybersecurity Solutions Durham, Cloud Services Durham, Data Backup and Recovery Services Durham, IT Consulting Durham, IT Managed Services Charlotte, Cybersecurity Solutions Charlotte, Cloud Services Charlotte, Data Backup and Recovery Services Charlotte, IT Consulting Charlotte"
"support@techpulse.com","","","","(855) 512 6825","79 Madison Ave 8th floor","https://techpulse.com/managed-it-services-new-york/","TechPulse offers comprehensive Managed IT Services in New York. Our expert team ensures your technology infrastructure is secure, efficient, and fully managed to support your business needs.","TechPulse offers comprehensive Managed IT Services in New York. Our expert team ensures your technology infrastructure is secure, efficient, and fully managed to support your business needs."
"info@workplace-engineering.com","","","","312.801.9897","4237 N Avers Ave","https://workplace-engineering.com/contact/","Want to learn more about our organization, services or have a potential solution for discussion? Drop us a line below and we will get back to you as soon as possible. 4237 N Avers AveChicago, IL 60618312.801.9897info@workplace-engineering.com","Want to learn more about our organization, services or have a potential solution for discussion? Drop us a line below and we will get back to you as soon as possible."
"press@talroo.com","","","","(512) 717-0630","6433 Champion Grandview Way Bldg 2, Ste 150","https://www.talroo.com/","Discover Talroo's talent matching marketplace and revolutionize how you find frontline workers. Reach out to stop searching and start hiring.","Discover Talroo's talent matching marketplace and revolutionize how you find frontline workers. Reach out to stop searching and start hiring."
"sales@abhardwood.com","","","","773-279-9100","3100 N Elston Ave","http://www.abhardwood.com/","Choosing the perfect floor is easy when you’re informed about your options and you can make a comparison of which wood is right for your home or office.","AB Hardwood is the leading Chicago flooring and supplies provider. We offer a wide variety of pre-finished and unfinished hardwood flooring products such as solid hardwoods, engineered wood floors, Luxury Vinyl Hardwood floors (LVT & SPC), green floor finishing materials, and much more."
"rich@truenorthpmpconsulting.com","","","","(248) 760-6564","4801 Glenwood Ave Suite 200","https://truenorthpmpconsulting.com/","The Project Management Consultants at True North PMP Consulting can help you cut through the Clutter, Chaos and Confusion of your project.","SERVICES AUDITING Project Management Process Audit CONSULTING New Product Development & Commercialization Contract Project Management Services Schedule a Consultation PMP EXAM Certified PMP Exam Course"
"info@chicagohandyman.net","","","","(773) 982-5500","1500 N Halsted Ave, FL 2","https://chicagohandyman.net/","Hire the Handyman Chicago choses for home repair & remodeling Bathrooms, Basements, Tile Grout Repair, Water Damage restoration.","We provide residential and commercial handyman services in Chicago. From build outs to tear downs, and small repairs too."
"privacy@techstars.com","","","","","310 Comal St Suite 262","https://www.techstars.com/accelerators/austin","These cookies are necessary for the website to function and cannot be switched off in our systems. They are usually only set in response to actions made by you which amount to a request for services, such as setting your privacy preferences, logging in or filling in forms. You can set your browser to block or alert you about these cookies, but some parts of the site will not then work. These cookies do not store any personally identifiable information.","Under the California Consumer Privacy Act, you have the right to opt-out of the sale of your personal information to third parties. These cookies collect information for analytics and to personalize your experience with targeted ads. You may exercise your right to opt out of the sale of personal information by using this toggle switch. If you opt out we will not be able to offer you personalised ads and will not hand over your personal information to any third parties. Additionally, you may contact our legal department for further clarification about your rights as a California consumer by using this Exercise My Rights link.If you have enabled privacy controls on your browser (such as a plugin), we have to take that as a valid request to opt-out. Therefore we would not be able to track your activity through the web. This may affect our ability to personalize ads according to your preferences."
"info@upstatement.com","","","","","80 Prospect St","https://upstatement.com/","We buildDigital products, apps, and servicesLarge-scale digital platformsDigital editorial productsBrands and design systemsForEstablished brandsHistoric institutionsVisionary leadersMission-focused startups","We buildDigital products, apps, and servicesLarge-scale digital platformsDigital editorial productsBrands and design systems"
"Info@bastettechnologies.com","","","","858-215-1570","740 13th St","https://www.bastettechnologies.com/","At Bastet Technologies, our mission is to empower organizations with cutting-edge solutions that safeguard their digital assets and drive digital transformation. We help organizations by enhancing efficiencies, fostering growth, and empowering businesses to thrive in a connected world. We are dedicated to providing exceptional service, leveraging cutting-edge technology, and cultivating a collaborative approach to address our clients' unique challenges. Through our commitment to excellence and continuous improvement, we aim to be the trusted partner that enables success and resilience in a rapidly evolving technological landscape.","At Bastet Technologies, our mission is to empower organizations with cutting-edge solutions that safeguard their digital assets and drive digital transformation. We help organizations by enhancing efficiencies, fostering growth, and empowering businesses to thrive in a connected world. We are dedicated to providing exceptional service, leveraging cutting-edge technology, and cultivating a collaborative approach to address our clients' unique challenges. Through our commitment to excellence and continuous improvement, we aim to be the trusted partner that enables success and resilience in a rapidly evolving technological landscape."
"Events@Harvard.edu","","","","617 495 5758","20 Quincy St","http://www.hfc.harvard.edu/","The Faculty Club Events Management team can help you with arrangements for University, social and business events. Contact us atEvents@Harvard.edu","The Conservatory will be closed throughout the Summer, to be reopened in September."
"info-asia@GHBintellect.com","","","","(858) 367-3642","8380 Miramar Mall Ste 224","https://ghbintellect.com/","GHB Intellect is a full-service high-tech and intellectual property consulting firm serving technology, IP, investment, and legal firms.","Services IP Management Technical Analysis IP Valuation IP Monetization Patent Search Engineering Support Litigation Support M&A Support"
"marketing@triumvirate.com","","","","617-628-8098","200 Inner Belt Rd","https://www.triumvirate.com/?utm_campaign=gmb","Triumvirate Environmental delivers environmental services to organizations in the life sciences, healthcare, higher ed, and advanced manufacturing sectors.","Triumvirate Environmental delivers environmental services to organizations in the life sciences, healthcare, higher ed, and advanced manufacturing sectors."
"david.abravanel@tandymgroup.com","","","","(212) 922-1001","75 State St Suite 100","http://www.longfordco.com/","We match high-quality talent with the right opportunities using a human-centered, AI-enabled approach.","We match high-quality talent with the right opportunities using a human-centered, AI-enabled approach."
"ask.gcr@zendesk.com","","","","1-888-851-9456","181 Fremont St","https://www.zendesk.com/","Discover AI-powered, award-winning customer service software trusted by 200k customers. Make customers happy via text, mobile, phone, email, live chat, social media.","Discover AI-powered, award-winning customer service software trusted by 200k customers. Make customers happy via text, mobile, phone, email, live chat, social media."
"vb@bushinconsulting.com","","","","612-644-6065","1595 Berkeley Ave","https://businessrelationshipscoach.com/","Business Consulting firm focusing on ethical and effective communication skills. Improve engagement with prospects and clients through the science of ethical influence and an effective good-faith negotiation system.","Business consulting firm, Effective Communication Skills, managing relationship with customers, relationship with customers, building a relationship with a client, building client relationships, negotiation and influencing skills, develop rapport with customers, Building trust in relationships, relationship build on trust, How to engage clients, communication and negotiation skills, How to negotiate, contract and negotiation, negotiation in contract, communication in negotiation, sales and negotiation, good faith negotiation, business negotiation, communication and communication skills, better communication skills, active listening exercises, improving trust in a relationship, how to have a tough conversation, how to have difficult conversation, negotiation planning, Robert Cialdini, modern persuasion, friendly persuasion, influential advertising, art of influence, Ethical persuasion, the science of persuasion,"
"info@pivotalpolicyconsulting.com","","","","602 294 0202","826 N 3rd Ave","http://pivotalpolicyconsulting.com/","Pivotal Policy Consulting is a full-service government relations firm offering a wide range of lobbying and public affairs consulting services for corporate, nonprofit and government clients. Our team combines over 50 years of lobbying experience at all levels of government, including local, state, and federal.","Lobbyists | Government Relations | Public Affairs | Public Policy Experts Serving Arizona-based and National Clients"
