"Email","First Name","Last Name","Company Name","Phone Number","Address","Custom 1","Custom 2","Custom 3"
"info@manhattan-bookkeepers.com","","","","212-390-1320","14 Wall St 20th floor","http://www.manhattan-bookkeepers.com/","Manhattan Bookkeepers Inc is expert in payroll, bookkeeping services in Manhattan NY. Call Manhattan Bookkeepers - accounting, bookkeeping, payroll in Manhattan NY.","manhattan bookkeepers,payroll,bookkeeping,new york,cfo,financial analysis,small business bookkeeping"
"Hello@howlecreative.com","","","","(206) 488-4063","100 S King St #100","https://howlecreative.com/","Howle Creative offers website design, pay per click, search engine optimization, and graphic design services.","Howle Creative offers website design, pay per click, search engine optimization, and graphic design services."
"phoenix.staffing@frtline.com","","","","(602) 281-6591","2415 E Camelback Rd #701","https://www.frontlinesourcegroup.com/phoenix.html","phoenix temporary staffing agency, phoenix executive search, phoenix executive recruiting, phoenix staffing agency, phoenix employer agency, phoenix employment agency, phoenix staffing, phoenix staffing company, phoenix accounting staffing agency, phoenix administrative staffing agency,phoenix call center staffing agency, phoenix human resources staffing agency, phoenix information technology staffing agency, phoenix staffing services,staffing agencies in phoenix,employment agencies phoenixphoenix staffing agency, phoenix,temporary staffing,temporary,staffing,phoenix temporary staffing,temporary staffing in phoenix,phoenix staffing agencies,recruiting,legal staffing,pharmacy,grocery pharmacy,retail pharmacy","Phoenix Staffing Agency, Temporary Staffing & Executive Recruiter for Administrative, Clerical, IT, Accounting, Finance, Pharmacy, Legal Staffing in Phoenix AZ."
"hireright@sysazzle.com","","","","800.862.9545","4435 E Chandler Blvd Suite 200","http://www.sysazzle.com/","// From technology to practical business solutions Innovating Today’s Technology Sysazzle is a specialized technology solutions & staffing firm focused on Healthcare IT, Government, as well as Business and Technology. We are highly focused and pride ourselves on being forthcoming and honest with all of our clients and consultants. From Microsoft development, UI / UX […]","Services Technology Solutions Managed & Professional Services MSP Checklist Risk Remediation & Audit Supply Chain Consulting Technology Staffing MSP / VMS Practice"
"info@blacherandco.com","","","","(213) 487-4788","801 S Grand Ave #2009","http://www.blacherandco.cpa/","Services Business Services Audits - Reviews - Compilations Business Advisory Services Financial Planning for Businesses Business Valuation Bank Financing Small Business Accounting Bookkeeping Services New Business Formation Non-Profit Organizations Tax Services Tax Preparation for Businesses Tax Planning Individual Tax Preparation Estate & Trust Tax Services Tax Relief Services for QuickBooks Setup and Training for QuickBooks","Take a look at our Home page. Blacher & Co., Inc. is a full service tax, accounting and business consulting firm located in Los Angeles, CA."
"info@martal.ca","","","","1 (888) 557-7769","100 Pine St","http://www.martal.ca/","Searching for a B2B lead generation company to scale your tech business? Look no further than Martal, an award-winning global agency powered by top-performing SDRs!","Searching for a B2B lead generation company to scale your tech business? Look no further than Martal, an award-winning global agency powered by top-performing SDRs!"
"info@cloudbreakenergy.com","","","","(970) 425-3175","218 S 3rd St","http://cloudbreakenergy.com/","We use cookies to help you navigate efficiently and perform certain functions. You will find detailed information about all cookies under each consent category below.","Cloudbreak Energy is a privately held, national developer of distributed and utility-scale solar and storage projects."
"SUPPORT@BOOSTENX.COM","","","","415 578 9630","1460 Mission St","https://boostenx.com/","Marketing Solutions for Fintech Welcome to BoostenX, your trusted local partner for specialized fintech marketing solutions. Schedule a call Revenue Driven For Our Clients $10m $100m 100%100% About Why choosing BoostenX?","Marketing Solutions for Fintech Welcome to BoostenX, your trusted local partner for specialized fintech marketing solutions. Schedule a call Revenue Driven For Our Clients $10m $100m 100%100% About Why choosing BoostenX?"
"customersupport@profitpad.tech","","","","323-515-3961","8585 Katella Ave","https://profitpad.tech/","Services Bookkeeping Payroll Accounts Receivable Billing","Services Bookkeeping Payroll Accounts Receivable Billing"
"Info@GreenLeads.com","","","","877-575-3237","100 Montgomery St","https://www.green-leads.com/contact","Green Leads reps are motivated by one thing-delivering meetings that take place with the right prospects. They are basically an appointment setting concierges","Green Leads reps are motivated by one thing-delivering meetings that take place with the right prospects. They are basically an appointment setting concierges"
"support@dataminediscovery.com","","","","617-329-9530","40 Court St 2nd Floor, Suite D","https://dataminediscovery.com/?utm_source=GMBlisting&utm_medium=organic","We provide eDiscovery Services and Hosted Review services to attorneys in the U.S. 617-329-9530. Let eDiscovery Experts help with your eDiscovery Review.","We provide eDiscovery Services and Hosted Review services to attorneys in the U.S. 617-329-9530. Let eDiscovery Experts help with your eDiscovery Review."
"operations@pay-net.net","","","","(858)268-1000","8775 Aero Dr #235","http://www.pay-net.net/","Pay-Net SOLUTIONS Our Services Background Checks Labor Law Poster Service","Tailor-Made Solutions for Your Business' Payroll and HR Needs"
"support@trykintsugi.com","","","","+1 (415) 840-8847","156 2nd St","http://trykintsugi.com/","Accelerate compliance with Kintsugi’s AI-driven sales tax automation for global businesses. Reduce errors, save time, and scale with confidence.","End your sales tax compliance frustrations with automated processes across platforms like Shopify, Amazon, and QuickBooks. Our end-to-end tax compliance is the solution for businesses struggling with taxes and accountants falling months behind."
"press@swzd.com","","","","","625 2nd St","https://www.ziffdavisb2b.com/","Reach tech decision makers at the right place, at the right time, across any vertical worldwide.","Reach tech decision-makers at the right place, at the right time, across any vertical worldwide."
"abs@acctbusol.com","","","","(510) 847-4539","2081 Center St","http://www.acctbusol.com/","ATBS is perfect when you are looking for tax accounting system installation, Bookkeeping Services, and Customized Tax Consultancy Services in Berkeley, Oakland, Richmond, Albany","Our Goal is to Provide Accounting, Tax & Business Solutions for Small and Medium-Sized Businesses Comprehensive Accounting, Tax & Bookkeeping Services Accounting, Tax and Business Solutions (ATBS) is based in Berkeley, provides general accounting services, system setup, QuickBooks configuration, installation, bookkeeping services, staff training, and support to small and midsize companies in Berkeley, Oakland, Emeryville, […]"
"hr@raptorconsultantsgroup.com","","","","(919) 388-1920","3200 Wake Forest Rd UNIT 206","https://www.raptorconsultantsgroup.com/","We are an outsource sales and marketing firm that specializes in customer relations, promotional marketing and retail branding for large corporations.","We are an outsource sales and marketing firm that specializes in customer relations, promotional marketing and retail branding for large corporations."
"sales@nan.com","","","","508-339-0482","1 Summer St","http://www.nan.com/","Cybersecurity isn't a product, it's a promise. Secured Networks. Holistic cybersecurity platform from NAN","Cybersecurity isn't a product, it's a promise. Secured Networks. Holistic cybersecurity platform from NAN"
"info@brafton.com","","","","617-206-3040","600 California St","https://www.brafton.com/content-marketing-agency-san-francisco/","We use cookies to help you navigate efficiently and perform certain functions. You will find detailed information about all cookies under each consent category below.","Brafton is an award-winning full-service content marketing agency in San Francisco, offering content creation, strategy and distribution; SEO, PPC, more."
"sales@aypconsulting.tech","","","","123 564 7899","1366 Turk St","https://www.aypconsulting.tech/","AYP Consulting was created by HR software start up Implementation and Services leaders. We understand what it's like to operate fast growing small businesses","AYP Consulting was created by HR software start up Implementation and Services leaders. We understand what it's like to operate fast growing small businesses"
"contact@ascendcohealth.com","","","","","350 N Orleans St","http://ascendcohealth.com/","The first surgical asset management platform built for operational efficiency and quality across every department. OUR JOB IS TO HELP YOU MEET SURGICAL DEMAND","The first surgical asset management platform built for operational efficiency and quality across every department. OUR JOB IS TO HELP YOU MEET SURGICAL DEMAND"
"info@courtesyaccounting.com","","","","206-932-4855","4411 California Ave SW","http://www.courtesyaccounting.com/","Services Bookkeeping Financial Statements Individuals Payroll Services Business Tax Returns Tax Planning","Services View All Services Bookkeeping Financial Statements Individuals Payroll Services Business Tax Returns Tax Planning"
"service@allaboutbusinesses.com","","","","425-748-8811","6000 Stewart St Ste #300","https://allaboutbusinesses.com/bookkeeping-seattle-washington/?utm_source=Local&utm_medium=GoogleMaps&utm_campaign=GMB-Seattle","Services Accounting Bookkeeping Accounts Payable Accounts Receivable Payroll Tax Preparation Tax Relief See All","Services Accounting Bookkeeping Accounts Payable Accounts Receivable Payroll Tax Preparation Tax Relief See All"
"info@crossrealms.com","","","","(312) 278-4445","141 W Jackson Blvd","https://crossrealms.com/","At CrossRealms International, we provide exceptional IT services for forward-thinking companies. With a team of certified engineers available around the clock on a scalable model to support your business infrastructure, cloud, applications, and security, we’ve got your entire technology stack covered.","At CrossRealms International, we provide exceptional IT services for forward-thinking companies. With a team of certified engineers available around the clock on a scalable model to support your business infrastructure, cloud, applications, and security, we’ve got your entire technology stack covered."
"sonya@vazquezco.com","","","","360-871-7898","701 5th Ave Suite 4200","http://www.seattlerestaurantaccounting.com/contact.htm","Services Accounts Payable Financial Reporting Payroll Services Tax Preparation and Planning","Vazquez & Company is a Seattle CPA firm specializing in accounting and tax services for local hospitality businesses."
"info@primaryposition.com","","","","1 (201) 381-8105","244 5th Ave 2575 Unit 2","https://primaryposition.com/","Primary Position is an Advanced Search Marketing Agency with Top SEO Experts like David Quaid, in NYC specializing in difficult SEO projects , B2B Technology and supporting other SEO/PPC Agencies","Our goal isn’t to just be the best in our field, but to work with the best clients to create the most successful SEO and PPC Campaigns, but to deliver a programme built around Return on Investment. We’ve learned a lot about Search Marketing because we’ve learnt a lot about consumers and how the internet works."
"careers@tunetx.com","","","","","300 Morris St","https://tunetx.com/","We use cookies to help you navigate efficiently and perform certain functions. You will find detailed information about all cookies under each consent category below.","Tune Therapeutics aims to bring gene, cell, and regenerative therapies into a new era of human medicine – expanding their range of application to common, chronic and age-related diseases that are straining healthcare systems and limiting human healthspan on a global scale."
"office@solarleadshub.com","","","","(646) 583-1385","111-27 Wood St","http://solarleadshub.com/","We specialize in delivering highly convertible exclusive residential solar leads. Make the most out of your pay-per-lead model.","Welcome to Solar Leads Hub, a leading Solar Appointment Setting agency. We specialize in providing exceptional lead generation services through telemarketing, helping solar companies connect with potential customers and grow their businesses. At Solar Leads Hub, we understand the importance of renewable energy and the positive impact it has on our environment. Our mission is to bridge the gap between solar companies and homeowners or businesses interested in adopting solar power. We believe that every contact we make brings us closer to a greener future."
"contactus@mprintgroup.com","","","","","9301 Globe Center Dr #120","http://mprintgroup.com/","Our team has built a solid reputation in the industry because of the deep passion we have for what we do. Our clients regard us as true partners and as an integral part of their business model. We have the resources, the equipment, the people and the passion that it takes to bring value to your organization.","We have built a very cohesive, respectful and resourceful team of professionals that know how to work together and we all share the same commitment to excellence. We value our employees and empower all to make sure that the products and services we provide are of the highest quality and meet or exceed the expectations of our clients."
"jeff.brown@mossadams.com","","","","(206) 302-6420","999 3rd Ave #2800","http://www.mossadams.com/about/locations/seattle","Our Moss Adams Seattle office is home to professionals who specialize in assurance, tax, and consulting services.","Our Moss Adams Seattle office is home to professionals who specialize in assurance, tax, and consulting services."
"info@simply-branded.com","","","","+1 (323) 419-5989","3415 S Sepulveda Blvd Ste. 1000","http://simply-branded.com/","They now feel like part of my team, which is a huge resource when I need someone reliable to ask questions and discuss strategy with. Their service is clear in description and they deliver on their promises. They are much more professional than many other outfits, and I know for a fact they are competitively priced after reviewing their quote to me with others in the industry.","Los Angeles Digital Marketing Agency helping businesses grow through strategic marketing, web development, social media management, and more."
"partnerships@harness.co","","","","(646) 586-5427","32 6th Ave","http://www.harnesstax.com/","Optimize your tax practice with advanced software, expert support, client introductions, and a professional community—all in one place.","Optimize your tax practice with advanced software, expert support, client introductions, and a professional community—all in one place."
"contact@targetsnatch.com","","","","","1226 Franklin St","https://www.targetsnatch.com/","TargetSnatch delivers qualified B2B meetings through AI-powered lead generation. We guarantee 15+ qualified meetings per month or work for free. Our hyper-personalized approach combines cutting-edge AI technology with human expertise to fill your sales pipeline with decision-makers ready to buy.","Get 15+ qualified B2B meetings delivered to your calendar every month, guaranteed. TargetSnatch combines AI technology with hyper-personalized outreach to connect you with decision-makers ready to buy. 85%+ open rates, 15% response rates, and a proven track record of generating $6M+ in pipeline revenue. Book your strategy call today!"
"info@eocpeople.com","","","","305-442-6000","3191 Grand Ave #332173","http://www.eocpeople.com/","Services & Solutions Submenu Conventions & Events Brand Ambassadors Administrative Professionals Hospitality","We believe that events are about people. By providing the personnel and support to create unforgettable experiences, we can help bring your vision to life."
"Lance@impacctusa.com","","","","212-481-2302","15 W 26th St","http://www.impacctusa.com/","We offer everything from high end CFO services to simple bookkeeping support. Big or small, we have something that will fit your needs","Services Business Processes Processing Service Team Technology & Admin"
"ashesh@digiprima.com","","","","1 6266163663","47 W 13th St","https://www.digiprima.com/?utm_source=google_my_business_profile&utm_medium=gbp_view_website&utm_campaign=dm_team&utm_term=custom-software-development-company","Get in touch with Digiprima for enterprise AI, BI, web, and mobile app solutions tailored to your business needs.","ABOUT USDigiprima Among Top AI CompaniesFoundedin 2016, Digiprima Corporation began as an IT consulting firm before pioneering AI solutions. Recognizing the market shift, we evolved from web and app development to delivering cutting-edge AI systems, helping businesses automate, predict, and grow. Today, we serve global clients with tailored AI tools, from chatbots to predictive analytics.Why Choose Us?Proven Evolution:From code to AI—we adapt with tech trends.Client-Centric AI:Solutions built for real business challenges.MORE DETAILS"
"GlobalHR@cloudctech.com","","","","+1(770) 765-2923","7055 Hillcrest Chase Ln","http://www.cloudctech.com/about-us/core-values/","People, Process and Technology. Our experts align with clients to understand their infrastructure, IT need and businesses to build strong programs and management to ensure availability, performance and protection-APP. We value and belief in human productivity and collaborations. Quality...","People, Process and Technology. Our experts align with clients to understand their infrastructure, IT need and businesses to build strong programs and management to ensure availability..."
"file@etcpa.com","","","","+1 718-261-9600","70-50 Austin St Suite 101 Upper","http://etcpa.com/","We are a Certified Public Accounting FirmSOLIDSERVICE AND TRUSTIS HOW WE DO BUSINESSEdward Torres, CPA PC is a full-service CPA firm located in Forest Hills for over 20 years. We provide tax, accounting and financial services for individuals and businesses. Our team can help you with incorporation, bookkeeping, payroll and sales taxes and these services can help you improve your bottom line.Your business’ health is our business. There are too many companies that lose revenue and tax benefits due to poor accounting and tax practices. We are trusted professionals that can provide custom tailored services to help ensure your success.Referrals have fueled our business growth and we consider it a great compliment to receive referrals from family and friends. Keeping our commitments to our clients is an essential part of our commitment to excellence.We look forward to helping you!","OUR SERVICESTax Preparationbookkeeping & payrollTrust Estate Filings 1041Sales TaxTax Resolution & Audit RepresentationTax ConsultingNeed something else?See our full list of services here!"
"info@optiononetech.com","","","","+1 (617) 655-8060","101 Arch St","https://optiononetech.com/","Option One is one of the leading providers of IT Support for Financial Institutions. Let our expert consultants take your firm to the next level.","Option One is one of the leading providers of IT Support for Financial Institutions. Let our expert consultants take your firm to the next level."
"hello@softcircles.com","","","","608 620 7036","245 Newkirk Ave #3","https://www.softcircles.com/software-development-company-in-new-york","SoftCirlces, LLC is top-rated custom software Development Company in New York. Get ultra-fine custom nyc software companies services in NYC and surrounding.","nyc software companies, software designing companies, new York software companies, software company new York,"
"info@directreach.us","","","","+1 213-510-0615","611 Wilshire Blvd #900","https://www.directreach.us/","Direct Reach provides targeted, high-quality email lists for businesses across industries. Connect with decision-makers and boost your marketing ROI with customized email data solutions, buy email list at cheap price","Direct Reach provides targeted, high-quality email lists for businesses across industries. Connect with decision-makers and boost your marketing ROI with customized email data solutions, buy email list at cheap price"
"NOC@AtomicData.com","","","","1-800-285-5179","250 S Marquette Ave #225","http://www.atomicdata.com/","You do you. We do IT. Your IT reality won't look like everybody else's because you're not everybody else. At Atomic Data, we meet you where you are.","This website stores cookies on your computer. These cookies are used to improve your website experience and provide more personalized services to you, both on this website and through other media. To find out more about the cookies we use, see our Privacy Policy ."
"MGMT@cloudandspirits.com","","","","(617) 945 1158","795 Main St","http://www.cloudandspirits.com/","",""
"info@Intellicoworks.com","","","","+1 773 9777906","122 S Michigan Ave suit 1390","https://intellicoworks.com/","Intellicoworks is a leading DevOps services company providing DevOps consulting services to streamline your software development process. Contact us today!","Intellicoworks is a leading DevOps services company providing DevOps consulting services to streamline your software development process. Contact us today!"
"bekahdubois@gmail.com","","","","650-521-1779","380 Hamilton Ave Suite 897","http://www.bekahdubois.com/","ATS provides experienced, certified professional accounting, tax and data services (including transfer & repair) and targeted one-on-one or group training.","ATS provides experienced, certified professional accounting, tax and data services (including transfer & repair) and targeted one-on-one or group training."
"carly@saleshive.com","","","","+1 (888) 333-3096","3063 Brighton Blvd Unit 740","https://saleshive.com/","SalesHive is an established B2B Lead Generation Services & SDR Agency that scales outbound lead generation. Meet your new B2B Sales Agency!","SalesHive is an SDR Agency that performs B2B lead generation services to book qualified sales meetings. Meet your new outbound sales team!"
"sdsurffeedback@sdsu.edu","","","","(619) 594-1900","5250 Campanile Dr","https://foundation.sdsu.edu/","Departments Accounts Payable Communications Executive Office Facilities Financial Services Human Resources Information Systems Payroll Purchasing Risk Management SR Administration SR Contracting & Compliance SR Development Division of Research and Innovation","About Us Board of Directors Financial Statements & Reports Governing Documents Management Team Mission, Vision, and Values Organizational Charts Requests for Information SDSURF Reports/Publications SDSURF Directory"
"info@prosum.com","","","","1-888-318-4780","515 E Grant St suite 150","http://www.prosum.com/","An IT staffing agency serving LA, Southern CA, Denver and Phoenix, Prosum delivers tech recruiting solutions to companies in all industries.","An IT staffing agency serving LA, Southern CA, Denver and Phoenix, Prosum delivers tech recruiting solutions to companies in all industries."
"info@wejungo.com","","","","(858) 304-0249","10505 Sorrento Valley Rd UNIT 125","http://wejungo.com/","Wejungo is a different kind of partner. We are People Strategy Consultants, not headhunters or recruiters. There's a better way... this is it.","Wejungo is a different kind of partner. We are People Strategy Consultants, not headhunters or recruiters. There's a better way... this is it."
"sales@corvado.com","","","","404.856.4400","Centennial Tower, 101 Marietta St NW","http://www.corvado.com/","Discover Corvado's suite of cloud-based software solutions built on cutting-edge technology. Unlock your digital transformation and focus on your core business.","Discover Corvado's suite of cloud-based software solutions built on cutting-edge technology. Unlock your digital transformation and focus on your core business."
"info@reverseable.com","","","","+1 888 848 4440","8101 Biscayne Blvd Ph 703-32","https://www.reverseable.com/","We engineer scalable, intelligent solutions on the world’s most trusted cloud and AI platforms—empowering you to focus on what drives your business forward.","Services Technologies Industries Company Contact talk to an expert"
"info@saratechnologies.com","","","","858-848-1784","11405 W Bernardo Ct Suite A","https://www.saratechnologies.com/","SARA Technologies Inc. is a globally appreciated Industry 4.0, and let’s collaborate with our professional team of AI developers to reshape & refine the ways to do business.","industry 4.0 solutions, industry 4.0 technology solutions, blockchain technology solutions, blockchain technology company, blockchain technology solutions provider, web3 solution services. Metaverse game development services, nft development services, application development services, software development services, web application development services"
"suport@avscomputer.com","","","","(678) 408-7840","235 Peachtree St","https://avscomputer.com/","computer service, it support and solutions, tech support, professional IT services, computer products, trusted computer store, quality computer hardware, reliable computer services, custom pc builds, network setup and management, fast computer repairs","Expert IT solutions in Atlanta, GA. Get your free consultation with AVS Computer Services today!"
